genre,name,critic_reviews,audience_reviews
Action,animal_2023_2,"Trashy, idiotic, and filled with disgusting bloody violence that's overly repetitive, Animal is excruciatingly too long at 201 minutes. This garbage movie has no redeeming qualities. It's yet another stupid story about feuding and vengeful families. Beyond the never ending reign of bullets and butcherings, both Animal and Kapoor's vicious Ranvijay remain hollow. Animal is a complicated film with a top-tier Ranbir Kapoor, who delivers a powerhouse performance that is worth the price of admission alone. What the film lacks in substance, director Sandeep Reddy Vanga makes up for with sheer audacity and bloodshed. Ranbir Kapoor is deeply committed to his brash and ugly protagonist, but in spite of the movie’s explosive action, director Sandeep Reddy Vanga seems more preoccupied with provoking outrage than with telling a coherent story. Boring, blood-spattered film... Animal’s terrible attitude to women runs alongside a cunning use of India’s religious minorities.  Bigger, longer, bloodier: Animal is all that and more. A story which is cheerfully misogynistic, morally bankrupt and stomach-churningly violent.  All of which I could have endured if the drama and emotions had held.  It is easy to dismiss Animal as an indulgent film, one that achieves none of what it sets out to. It is. It is repulsive, revolting, and one-and-a-half- hours too long. But it is also a film that unravels as retaliation. The film washes past you, like sandpaper being rubbed against your aesthetic and moral convictions.  Watch Animal to see Anil Kapoor and Ranbir Kapoor rising above the ridiculous to give a sublime performance. Ranbir Kapoor stars in a blood-soaked drama about daddy issues that is screaming at the top of its lungs with nothing to say. Ranbir Kapoor plays one of the vilest protagonists in cinema history. ANIMAL is a pretty crazy, but somehow totally original and fresh THE GODFATHER remix, with an insane Ranbir Kapoor, a super strong Rashmika Mandanna, great music and, above all, the right amount of humor and irony. The main objective is to serve up everything and the kitchen sink. It can’t be called a cinematic feast, as it is a chore for moviegoers forced to digest heaps of plot points and tangents.  At three hours 21 minutes, Animal is relentless as a euphoric medley of feral rage and dance of the dysfunctional. The twists go on well until end credits as more blood is splattered our way. Welcome to the jungle. Like nearly every factor here, the songs and blood-soaked interludes alike are not without skill, but get kick-dropped into an inorganic whole uninterested in integrating them to sustained, logical or emotionally credible effect. During the interval, I was at a loss of theories. I didn’t know what to make of him or the film. All I could ask was: What’s the point? Why is Animal? Animal is an adrenaline experience which will have polarising views but you can't deny its entertaining quotient, breathtaking performances and storytelling. Reptile-eyed even at his smouldering best, Kapoor’s career-best performance makes Animal tough to stomach, but equally difficult to ignore. Ranbir Kapoor's action tale is flawed, overtly violent and misogynistic...","Suberb movie ranbir's acting is spontaneous 🔥 The movie dragged a lot...Overkill.
Starts off interesting but ends up with a bitter taste..

Narcissism, gaslighting, adultery, short tempered, anger issues, daddy issues, detachment issues ..and the list goes on..

Had to detox my brain just for watching this movie🧠 Sat down for the entire 3hr 20min and didnt get bored. Animal movie is the collage of the insta reels put together unimaginably, to ignite the spark within the youth with low IQ and even lower span of attention. But that is what an Indian audience will get, who grew up on Salmanolothic and Govindaesque mindless flicks of 3 hours. What a waste of so much talent, but a much appreciated effort by the post production and marketing team to make this project a monetary success. Amazing movie, 10 out of 10 “The Arab middle easterners are here; the Arabs are here! Can I rate this 0/5?
Mysogynist director and his pathetic script. This movie disgusts me.
Sandeep Reddy Vanga definitely is disturbed in the head to make movies like this one and Kabir Singh LOL. Top notch acting, music, action. Excellent performance by Ranbir and all other co-stars. It has some short comings, but is perfect combination of top class acting, music, action, emotions, family and relationships. Waste of money and time Bollywood has once again proved that it can't parallel Hollywood.

Animal is among the longest movies of the Bollywood, spanning over 3 hours 20 minutes. Yet it's a total waste of time. Even the title has no direct connection with the plot. 

The attempt is to present a deep psychodrama of father son relationship. But the plot is a thorough failure. But no doubt, the performance of Ranbir Kapoor is good and spreads colors on the canvas.

Yet the youth will love this movie as it shows brotherhood and stubborn attitude.

Overall, the film is a tasteless amalgam of action and emotions. It's better to watch some stock drama than to waste time on this fazool film. It makes sex unsexy and for a movie with this budget very shitty editing Absolutely endearing story of a sons love to his father and his family. Must watch for any Bharatiya. I think this movie has a negative impact on society. A little over the top but definitely worth a watch for mature audience. Worst movie ever. That much violence is insane and would not recommend it to anyone. Waste of time. What the f*ck did I watch! First 40 minutes were too abrupt and quickly stitched to try to make a point which wasnt landing. Action sequences were the savior amidst weak acting and characters played by Anil Kapoor. Outstanding Performance by Ranbeer Kapoor !! Unbelievable movie! Too much violence and not family oriented Excellent movie. Love to see the father and son bonding."
Action,silent_night_2023,"...all-too-quickly collapses under the weight of its intriguing yet progressively untenable gimmick... This comeback movie has a lot of what Woo is famous for, such as operatic gunfights, but it also has something new: there is almost no dialogue over the 104-minute run-time. Those wanting a John Woo return will have to wait. Unfortunately, Silent Night is too bland, boring, and poorly made to bring him back to the mainstream. Strikes the perfect balance between intense action sequences and equally commanding emotional moments to create a stunning film that fires on all cylinders. This film reunites us with an old teacher who has become a competent imitator of his students. [Full review in Spanish] It is worth noting the poor aim that gang members have in general, and against Brian in particular. [Full review in Spanish] Narratively, there's something missing here but once it gets going, the action is there; it holds your attention.  The new movie feels too simple for him [Woo], a thriller with only vengeance on its brain. Great for those who just want action, action, action and don't care about character development. While the Chinese-Hong Kong filmmaker returns with a fairly minor film... there are a few self-tributes and a handful of pure tense-filled scenes that allow us to remember the good (best) times in Woo's cinema with a smile. [Full review in Spanish] Silent Night is a collection of parts that never become the film the trailer promises, or the film I think Woo intended. And yet, for the occasional flourish of the old mad genius that survives here, I'm still glad I saw it on a big screen. A curious experience: an action thriller with sequences of brutal violence, which tries to justify the actions of its protagonist in the most sentimental way possible. Full review in Spanish. Silent Night will not teach anyone anything, but I found it a highly watchable, if subpar work from a master filmmaker. That’s not a recommendation, but for some of you, the message should be clear. If you can stomach the first act as an interesting and flawed creative experiment and enjoy revenge stories with bloody denouements, though, there’s still something to enjoy here by the time the credits roll. Just don’t expect much from it. Blood spurts forth in great volume as the bullets criss-cross the frame, yet Woo manages to keep focus on his anti-hero’s humanity and motive...a ripping action drama.  It's bad, but at least it's also super depressing. If you think I care that you might see spoilers in this review, then you completely underestimate my utter contempt for this movie. The director’s first Hollywood film in twenty years makes it clear that he hasn’t lost his touch, but a stronger (or at least more interesting) foundation to launch his signature style on might have made for a more satisfying comeback. Joel Kinnaman descends into full bore badassery in the feral heat of director John Woo’s wordless venge-fest. Though the veteran director has mellowed, the pure energy pulsing through Silent Night proves Woo is still a grandmaster of kinetic cinema.","Horrible. Absolutely horrible. I am a John Woo fan, but this movie was not enjoyable in any way. The story is tired. We have seen this tale of revenge too many times, and the only way to make it worth seeing again, is to get us invested in the characters and reward us with highly-stylized John Woo action. Unfortunately that doesn't happen in this movie. So boring. (I was with a fried who did not want to leave, otherwise I would have left the theater about 20 minutes into it.) The whole car-play violence is uninteresting, and the gun-play lacks all coolness that one would usually associate with John Woo. 

So how bad was it? Bad enough I would say not to bother watching it at the theater, at home, or anywhere ... even if it is free. Complete waste of time. While the premise of a movie with no dialogue due to the main characters initial trauma is unique, and it did create for some truly great moments for Joel Kinnaman to shine through with his ability to convey raw emotion. It made for a long movie with a tenuous grip on a plot. Well, we all know that John Woo makes very violent over the top exaggerated movies, but some are just lame. This one, in fact, starts out really well, with a cool chasing scene, but then comes an endless boring part of Joel's (and his wife's) suffering which we would all skip if we were at home on cable, and thus avoid 75% of the movie. When it finally, and I mean finally, comes to the showdown (one really can't call it a climax as nothing is slowly rising before),  the typical Woo ""Shoot-out"" is so ridiculous and idiotic that one wants to leave before it is even over. Actually half of the spectators walked out during the movie (and I have never seen so many leave early in any movie during my whole cinephile life). I'd say it is the worst flick Woo ever made. 2/10 points (and without the opening scene it should be 1 point). If I could give 0 stars I would. Half the movie is just dead kid exposition and the other half is mostly a boring training montage with a tiny sprinkle of action. Every event in the movie lasts way longer than it should and the whole thing feels like they're desperately trying to hit the two hour mark. Good premise, but not having any dialogue really threw me off. And the constant flashbacks were overkill. The last 15 minutes became an extremely unrealistic and didnt pair well with the rest of the movie. Good action scenes with great acting Qué manera de perder mi tiempo en el cine con esta película. Me quedé dormido la mayor parte del tiempo, nunca pensé que en una ya que soy un ignorante en el cine; pero que parte tan importante son los diálogos y la música.
Yo sé que se llama venganza silenciosa en México pero era demasiado el silencio que me daba amnsiedad y sin una buena música que acompañara al pobre actor decadente se sentía un gran vacío. 
Rescatable unas pocas escenas de acción. Se sentían más en los sentimientos del mudito, cuando uno va por la venganza y la sed de sangre que habría de tener el anglosajón pero quedó a deberme mucho. Poorly written mediocre acting -- not at all what we expected from John Woo.  Took WAY too long to set the characters and story up,  The action scenes in the trailer are pretty much it.   By about the tenth time he plays the music box people in the theatre were openly groaning.  One of the people in the couple next to us was sound asleep at the end. The movie had good and bad parts. what we did not like about the movie's ending was how he died and the cop died. it should have ended where someone found them they both ended up in the hospital and that's how the movie should have ended where they were okay. I HAVE NEVER WALKED OUT OF A MOVIE UNTIL TODAY.  Dude I know the movie is called silent night BUT DAMN, most movies are called certain things… and not ACTUALLY relate to the title. I mean nooOooo one SPOKE the entire movie. All I heard was the guy next to me eat his candy. Total SILENCE. JEEZ MAN, but you BET I walked out of that theater and watched another. Excellent movie with a spot on effect to fit the title. Wow. That was an hour and half of my life I will not get back. I get it he can no longer speak but his wife won't ether? Zero dialog. My mail man could be the star in this movie. No talent needed, Unrealistic and poor directing. Waste of my time and money. An excellent John Woo action film. Full of explosions and shooting. Don’t expect any talking. This is John Woo doing what he does with his craft!!! It’s ok but Wait til this comes out on free tv. This movie had a great script and the acting as great. This is must see movie done by John Woo Ignore the negative reviews. Yes, it’s true there was no dialogue in this flick but that doesn’t mean it was a ‘silent movie.’ There was background music and some police radio chatter. Had I not read the reviews, I’m not sure I’d have realized there was no person to person dialogue. The movie still ‘communicated.’ It’s a vengeance action flick and that’s just what you get. Wow this movie is amazing! Had us so into it! Very suspenseful and full of action! We enjoyed it very much ! (: What a total waste of time! Save your money and don’t go see this one! If I could give it negative stars, I would! it was your typical Revenge movie nothing special about it his kid is killed so he kills a bunch of people has almost nothing to do with Christmas"
Action,the_marvels,"""The Marvels"" is as uninteresting as it is irrelevant, as its opening scenes make clear. [Full Review in Spanish] It's not Marvelous.  The Marvels neglects to fulfill the most basic tenets of being its own movie.  The Marvels is a perfectly fine superhero flick - sitting amongst a rocky at best Phase Four and a one for two score so far in the latest Phase. A pedal-to-the-medal and often humorous adventure that serves as a sequel to both the 2019 movie Captain Marvel and the 2020 MCU Disney+ series Ms. Marvel. I feel like they played it ""safe"", which significantly lowered the stakes for me. I loved the short running time but this movie struggled to find its footing.  This is far from the worst MCU film. It's actually quite charming and had some fun fight scenes. But tonally it was all over the place. Shout out to Iman Vellani who is incredible.  Inconsistent, interminable - and silly! It could have been a lot worse.  The primary plot lines are fun, yet they can also be confusing, and at times it becomes a little too much--although totally enjoyed the three lead girls working together. It's not going to win over people that are on the fence... but it's not bad. The Marvels is a diverting, easy to digest cosmic adventure that zips by at a breakneck pace and reminds us of the importance of family and friendship. Brie Larson leads a super-trio that works hard to blast some fun into this confusing adventure.

 “The Marvels” delivers a fun, well-paced superhero movie anchored by three solid, charismatic performances.   Oh boy, I am so tired of the MCU... Now it's the same film over and over and over again.  This is false sophistication, especially in this case, when it covers up the visual ineptitude and chaos of The Marvels.  The whole ""Captain Marvel"" franchise is diluted and shredded in this average action thriller. [The Marvels] feels like the finale to a season of television we never got, and perhaps a series would have given each of these characters the time they needed to fully explore each of their individual issues. It’s all rather standard superhero sci-fi ... with the welcome variation that almost all of the key characters are women. Vellani is funny and sweet as Kamala, an unabashed Captain Marvel fangirl who doesn’t hide her excitement at joining the fray.  If Marvel is trying to win back audience enthusiasm, centering its characters and a sense of fun is the right approach. And teaming up with talented directors like Nia DaCosta goes a long way on executing that approach","Another messy poorly written marvel movie. But the audio... Worst audio editing I've ever heard. Just noise pollution really. The movie is good but the characters are making me upset. 

SPOILERS!! ⚠️
Why close to the end Monica suggested to save Dar-Benn when she got stabbed by the shard of glass? Then she picked up her hammer and tried to kill them again like girl why did u even suggest that 🤓☝️ 
Second, The little girl Kamala is annoying me too.
Like girl be quiet sometimes 😭 then how does she not get in trouble for leaving her home and destroying the house in the beginning… my mom would've slapped tf out of me 💀

The movie is good but I like to just say stuff for saying sake. Don't take none of this serious it's a good movie in general should watch it if you like marvel. Personajes divertidos y una historia entretenida y trepidante hacen de The Marvels una adición agradable al Universo Cinematográfico de Marvel la recomiendo Short for a MCU flick, but it has everything the die hards will want, good action and typical Marvel humor, though that does not make up for its lackluster characters (Ms Marvel aside) and it’s bland bottom tier villain. I don't like the constant switching but it was better than expected It's the worth movie in all Marvel Universe.  Just a collection of scenes without a specific plot. Only the cat and Kamala play their roles. I highly not recommend 
spending 1:30 hours of your time watching this movie! I will never have this part of my life i wasted watching this huge pile of garbage. Geez. How did they mess this up so badly. Just how. TW;SPOILERS
The Marvels (2023) is another bad Marvel movie. Bri Larson, Iman Valenti and Toyanah Parris all play good character,it's funny. But there's like 30% of the movie that just feels dumb like when Monica gets trapped on the alternate universe or when she ends up being on that universe, as the dead one and not her mother so it just confuses me and I think that's a main part of why I hate it so much, there's too much of everything, and people saying their lines to fast. Like Iman Valenti's character always fan-girling over Ms Marvel even deciding to name her character that in a goddamn stupid montage. I can't stress enough that if ur reading this, PLEASE DON'T WATCH THE MARVELS (2023) Fast paced action movie of how an ordinary girl joins up with Captain Marvel & discovers her fate of defending the Universe. Sigo sin creerme que antes de su estreno en cines, The Marvels se haya convertido en lo que es para muchos, ""la peor película del UCM"" (incluso dicen que es ""incluso más decepcionante"" que la película de la Capitana Marvel). Fue que, por toda esta polémica, decidí ya verlo. ¿Y qué opino yo? No es una mala película. Incluso, hasta me parece mejor que su precuela. ¿Por qué? Miren, quiero aclarar que voy a ser sincero y solo es mi opinión personal. Nadie me pago para decir está crítica (ni Disney, porque ni me conocen). Tampoco soy fanboy. it wasn't as bad as the Youtubers were saying. I had to see if it would be that bad & it is not. Mediocre is what it is. I do not understand who they made this movie for. How can you make a profit pandering to such a small portion of your audience. Making a movie most people do not want to watch. Capt. Marvel was OK , this was . . . Divertida no muy larga especial para la familia Lots of comedy. I knew what was going to be the next movie. a  catastrophic disaster Had heard mixed reviews so decided to give this a go. Rather disappointed as it's not like the other movies at all, there's an expectation people will have watched some of the TV series (I'm assuming)?.. no idea which ones.

Anyway, it flies into it at the start with no introduction to any characters and the rest of it is a hot mess of things that again seem to require previous knowledge one or more TV series to understand what the hell is going on or who the characters are.

Should be a 0.5 star review, but I've upgraded to 1.5 as Brie Larson (seemingly) hasn't got the stick up her arse anymore. I found this movie to be an exciting, evenly paced super hero movie. There was nothing exceptional about it, but also nothing at all bad. If you want a fun evening of stepping into the world of Marvel with some beloved characters and some new ones introduced then I think it fits the bill. The Marvels had its ups and downs, but overall, it's a good movie. I honestly believe it was better than the first one. The Brie larson, Teyonah , and Iman were great 🔥🔥🔥 The villains master plan is plot ripped of from Spaceballs. Might as well be watching spaceballs instead of this. Although at times there were a couple of pacing issues, but the film does have some great moments especially from Iman Vellani's performance as Kamala Khan who stood out. Snoozefest of marvellous proportions."
