genre,name,critic_reviews,audience_reviews
Action,die_hard,"To say Die Hard still holds up is an understatement: charismatic protagonist and antagonist, great action set pieces, well paced and a top class finale. It’s no wonder so many other films and TV series continue to “do a Die Hard”, it’s still hard to top. Top to bottom, it is just endlessly entertaining and well-crafted with outstanding work from all involved. No matter how much action movies have continued to grow, this will always be the cinematic elder statesman that can scrap with the best of them. That’s right, I’m saying it, loudly and proudly, since John McTiernan’s 1988 action classic isn’t just set at Christmastime—it embodies the very spirit of the holiday. The gold standard for action filmmaking; what action movie tropes Die Hard doesn't follow, it reinvents or altogether originates, and all of them have yet to be bettered. Give Die Hard a fresh spin this year; it's the most joyous Christmas film of all!  I really appreciated the interpersonal relationship between him and his wife. It wasn't slow but it was taking its time. [It] may be the best action movie EVER. It's another anti-cheer holiday selection, but one that keeps on giving - rewatchable sans saturation... Sometimes-more often than not, even- a script with many hands on it becomes a case of too many cooks. With Die Hard, competing experienced creatives produced a film that works on multiple levels. Still the prototype of the modern action yarn -- its status was secured so rapidly that subsequent action romps were invariably described as ""Die Hard on a train / plane / bus / zeppelin / tricycle / what-have-you."" Die Hard is not only an excellent action film, it is an excellent film overall and its ability to stand the test of time and still hold up is admirable. A spectacularly thrilling film, possessing enough brains to match its brawn. The picture is extremely violent: bombs go off, bullets rip through flesh, heads are slammed against steel. But Die Hard is also smart, satirical-and, in an odd way, heartwarming. The director's spectacular ability to compose the plans and take advantage of the full range of the panoramic format possibilities. [Full Review in Spanish] It's a glorious scene-stealer for Alan Rickman, though it's a credit to Willis's cheeky charisma that his scene is not in fact stolen. Die Hard is a great example of the Hollywood studio system getting moviemaking right - the film is a perfect storm of story and talent coming together. Die Hard still feels as fresh and thrilling as the first time it screened. From the superb pacing through to the sarcastically sinister villainy of Alan Rickman, this remains a crucial template for the modern action film. It's as though the filmmakers approached each scene by asking themselves how entertaining they could make it. One of the very best action pictures of all time... Yippe-ki-yay indeed.","Best Christmas movie ever! I said it! Fantastic Christmas movie Bruce Willis himself said Die Hard is not a Christmas movie. it's a great, classic, action movie by all means. Is Batman Returns a Christmas movie? That movie is set during Christmas. Think about that 🤔.  😀 Classic 80s adventure… and yea it is a Christmas movie! Great to see a classic on the big screen the way it was intended. I hadn't seen this movie until it was offered in the Dolby theater at my local AMC. It was awesome! Such a fun story with crazy fun dialogue and action. Loved it. all time action great Where does the ambulance come from? Why does the elevator explode? I just had the good fortune to see an original print on the big screen, and this movie is still as fun the 20th time as it is the first. Sure it plays heavy on 80s heavy action, comeback lines and buddy chemistry, but nothing beats seeing a vulnerable, grade A Bruce taking out Rickman and his henchman one by one while having a few fun twists along the way. I have seen this movie so many times and it never gets old! I love Die Hard! It is a timeless classic! Loved seeing this classic on the big screen! one of the best Xmas Movies there is! Merry Christmas everyone!!!! This is the way to enjoy a movie. What movies used to be like. Fun. Third Best Christmas Movie ever made, right behind A Christmas Carol (Alastair Sim) and A Christmas Story but just ahead of Scrooged and Christmas Vacation! First time watching and wow, they just don’t make movies like this anymore. Was a cool watch in theaters, and I will always consider this a Christmas movie no matter what A towering achievement! One of my all time favorite action films Great action movie from start to finish. Funny one liners. Bruce Willis and Alan Rickman are perfect playing good and bad guys. It's just my opinion but this is not a Christmas movie. It takes place during Christmas but it's not about Christmas. Last thing, yippee-ki-yay mutha f@cker!"
Action,the_oath_2023,"The Oath is a faith-based movie about Judeo-Christian historical people, but this tedious drama is actually very soulless. The characters, story, and filmmaking are woefully generic, while the acting performances are dismally substandard. There are some well done elements throughout the film, but there are also moments where things collapse from the pressure. At various points resembling “Gladiator,” “The Passion of the Christ,” “Dances with Wolves,” “The Last of the Mohicans,” and “Braveheart,” “The Oath” mixes elements of drama, action, romance, and fantasy to stirring effect. I appreciate the filmmakers' intentions, but pledging to watch 'The Oath' may cause severe regrets. It's certainly no sillier in any way that I could see than, say, Conan the Barbarian or the Lord of the Rings flicks. And it's at least as heartfelt. The fact that in terms of subject matter this is an unusual film doesn’t mean it’s a good one... it’s solemn, repetitive and unexciting.  Clunky, dull and undercooked while very low on thrills, suspense and emotional depth.  A limp, underfinanced Pre-Columbian “Last of the Mohicans” action adventure...and a dull MesoAmerican thriller built on Mormonism’s foundation myth, with just enough magical thinking thrown in to make everything presented here play as eye-rolling hokum.","The Oath had great cinematography, beautiful music, and a compelling story. I want to see it again! This film is not perfect and not for everyone but I appreciated the way it explores the sometimes painful experience of being alone, with Moroni being the last of his people after the heartbreaking loss of his family, and imagines what it might have meant to him to find companionship. It is a plausible depiction of the Book of Mormon taking artistic license to imagine and tell details of the story that are unavailable to us while staying true to the book. Leaps and bounds ahead of any previous attempt at bringing the Book of Mormon to film, I hope this opens the door for more to come! So proud of Darin Scott for finally Making this happen!

This is a film I've been looking forward to for years, as I've been following Darin all along.

This is my honest opinion of what I observed and felt during the film!

The overall cinematography was superb, with breathtaking shots of a beautiful backdrop!

The costumes, language, and set was phenomenal!

Some of the acting was on point and other scenes left a feeling that there was something lacking… room for improvement for sure. I feel like some of the lines were canned, where others could have been developed further.

I love the vision that Darin has, and the idea of bringing the Book of Mormon to life is fantastic…and I think the lead character could be someone more polished and believable in their portrayal of Moroni…there were so many scenes that were a bit too much…sort of cheesy…

There were also parts that left me wanting to see more…such as when Moroni tells of his fathers of the past…it would be so incredible to have flashbacks to the times and people he is referring to, with vivid real life portrayals…

Overall, I felt that parts of the movie landed, and others lacked impact…therefore leaving me feeling like it could have been better at the end.

I hope that filmmakers will continue to utilize the beautiful stories of the Book of Mormon and courageously follow the lead of Darin Scott to venture into a world where these beautiful and often tragic stories are brought to the big screen!

If I were to score the heart of the movie, I'd give it a 10…over all for me, it's a solid 6.5, maybe 7!

With love and a desire to offer honest feedback,

- Paul Absolutely loved it!! Great watch, motivating and inspirational, hard to find on the big screen now days! It was a bit slow for me but I enjoyed the story and its connection to the Book of Morman. For a nonmain stream big-budget movie, this was amazing. well written and the acting was outstanding. If you have ever wondered what the Book of Mormon is about, or who wrote it, here is your chance to discover some insight and be entertained at the same time.
As our nation is crumbling under disbelief, hear a message from our forefathers who lived on this land and speak to us from the dust, a warning, turn back to God and live. Finally this hero of ancient times comes to life in a quality production. I would like to see more films on this subject in the future. Some scenes of violence not always necessary, but one of the best inspiring movie to see this end of the year. Loved the movie, can't wait until it's out on blue ray. I really liked this movie. Ive been backing it for 13 years. It wasnt what I expected but I really enjoyed this. If this movie does well it means we get Reign of Judges. If this is an indicator i will be. Also the fight scenes were very realistic but  still exciting! Go Watch it! This is the first Latter-day Saint film with an epic feel--think Gladiator or Braveheart. But rather than a classic warrior-protagonist as in those movies, Darin Scott's Moroni is true to the character in the Book of Mormon - Moroni is masculine but he is a devout Christian, who spends his free time studying Scripture and in prayer. When I got home from watching the movie, I felt motivated to be better and to do better, because I had just watched a convincing, three-dimensional portrayal of what it means to be a godly man. You owe it to yourself to watch this film in the theater. Amazing production. The music and scenic shots were great. The acting was solid. Costumes and makeup looked incredibly legit. There were touching spots in the story despite sometimes moving a little slow. I hope to see more films like this made. I felt the creators tried very hard to give the film an epic feel this history deserves. That's hard to get across without explaining a little more of the history. I started to feel that more at the end of the movie but might have helped people understand if more history/substance was given in the beginning. Please keep making these! The Oath tells a compelling story with ambitious cinematography, minimal dialogue, and a simple plot. Job well done capturing the solitude of a man without community and his reintroduction to human interaction. The acting is subtle, with good character development throughout. What I appreciate most about Mr. Scott's writing, directing, and acting is the deep reverence for life shown. Where many films today explore the relativity of good and evil, Scott draws a useful line in The Oath: evil is to treat life cheaply and good is to hold life sacred. What's more, this demarcation rings true. Scott's invitation to viewers to hold human life and relationships sacred is a vitally important one. Peace can fill our lives and the world when individuals, families, communities respect life, extend forgiveness, seek reconciliation, and promote the good of the whole human family. I wish more mainstream media exhibited such vision and used its power for good. Bravo Scott and team for your bold commitment to sharing good and promoting peace. Wife and I thought it was amazing. The story was moving and portrayed the struggle of choice and consequences and the meaning of keeping true to your word.  The music was moving as was the breathtaking cinematography.  Highly recommend seeing this movie. I am so glad I decided to watch this movie.  The visuals throughout the movie were a feast for the eyes. The music score was amazing. The story was awe inspiring. I highly recommend watching this movie. You will leave the theater feeling better than when you arrived. -FREEDOM!- So cool to see Moroni come to life. It makes me put myself in his shoes and wonder if I could be like him. It is filmed in such a beautiful place.
Loved it This movie was incredibly well cast.  The cinematography was superb, and storyline was simply inspiring.  Darin Scott is a genius storyteller and even better actor. It was good. I did enjoy it. Not what I expected. Understanding the intention behind it, not sure if it got there. For a low budget film, it was done well with the music and cinematography. A little more help with the story and character depth and it would have been a phenomenal movie. Great music, acting and cinematography. But why does Aaron seem to have a pirate accent? Interesting spin on the untold life of Moroni after the plates were finished. I’m not Native, but I imagine some portrayals may be offensive to them. The story line was a bit slow and didn’t seem to pick up until King Aaron meets Moroni towards the end. Also, some of the writing didn’t make sense to me. I am an inactive member of the church, honestly I wasn't to sure about seeing this movie.
I went anyways to show some support. 

In the beginning I wasn't sure about the acting part of the lady that played the husband of   Moroni. However the acting picked up from there and was progressively way better as the movie went on. I liked having a storyline, I feel if there was no storyline in the movie, it would be like watching one of those boring movies they have you watch in church. 

My son brought his girlfriend who has never been exposed to the teachings of the Book of mormon and  she loved it, especially the relationship between the sisters. 

I really enjoyed watching the movie, if I hadn't I would have walked out and I didn't. I didn't even want to get up and go to the bathroom bc I was going to miss part of the show.

I have read reviews pertaining to Moroni showing and flexing muscles ect. Let me ask you, if you ran around in the forest for 20 years in survival mode and carried a set of encrypted gold plates around that weigh between approx 40 lbs consistently you to would have would be ripped too! 

Great job Darin and Michelle and cast. A love story showing that even the most evil people can change. Knowing and living the truth makes them free on earth and beyond earthly existence."
Action,fast_charlie,"Pierce Brosnan has a wry sense of humor in this slick and violent piece of pulp entertainment. Phillip Noyce’s well-seasoned, blood-splattered throwback, a smooth ride that doesn’t wear out its welcome at a brisk 90 minutes. In addition to setting the scene gorgeously on the Gulf Coast, director Phillip Noyce knows how to keep things moving slickly. And he also finds ways to reveal internal motivations in characters even when things get silly. A weird noir that has so many permutations that even when you see them coming, they're italicized so you feel fondly towards all the tropes.  Pierce Brosnan drops his Irish elocution for a Southern twang in a breezy crime thriller with unexpected dark humor. Fast Charlie isn't extraordinary but has solid action, good cast chemistry, and enough macabre chuckles to warrant a recommendation. “Fast Charlie” doesn’t break any new ground in the genre, but it’s the sort of engaging escapade that Hollywood used to turn out with ease.  The movie adds little that's new to the tough-guy redemption genre — apart from a dead raccoon and some tasty tomato sauce — but it does revolve around the always likable Pierce Brosnan, who plays the courtly but dangerous Charlie Swift. Brosnan brings his brand of sly, flirtatious, reluctant heroism to the role. He and Baccarin make a good May/December pairing. Caan's last film. Talented collaborators on both sides of the camera have done better than this far-fetched Deep South crime thriller, although it intermittently rises above the formulaic fray. This is the farthest thing in the cinematic firmament from a world-changer you can imagine, but as an evening’s entertainment, it’ll more than do. The fact that Brosnan and Baccarin make us believe ... their ... strange relationship ... makes the material feel less routine than it could have been. The real motor that sustains Fast Charlie for the duration of its breezy 90-minute running time is the will-they won’t-they romance between Brosnan and Baccarin, both actors cultivating a palpable sense of intimacy. Feels like reheated Elmore Leonard leftovers. “Fast Charlie” doesn’t jump off the screen, but it’s an engaging ride with morally dubious people trying to figure out a future that isn’t guaranteed. An exhilarating, suspenseful and wickedly funny action thriller. Pierce Brosnan is at his best.  We’ve seen plenty of cinematic aging hitmen looking to retire to a more peaceful life before, but thanks to Brosnan’s ageless charm and a subtly rendered love story underpinning the proceedings, we’ve never rooted for one quite as much. Phillip Noyce’s charming if melancholic Southern gangland caper grants an old mob fixer a new lease of love and life Master-craftsman Phillip Noyce has built a well-constructed revenge thriller around star Pierce Brosnan. Anyone looking for a good old-fashioned thriller will have to search far and wide for one that works better than Fast Charlie.  I was taken with this minor gangster film because it does much without doing much. “Fast Charlie” is a modest genre movie, and that’s what’s good about it.","A decent little crime thriller, although the age gap between the main characters is a little too much to quite pull the story off convincingly. Fast Charlie fits perfectly into the constraints of its genre but with enough charm to make for a decent weekend movie night watch. Acting - 10/10
Photography - 15/10
Direction 16/10
Script - 10/10
Overall score - Effing fantastic. Get yourself the biggest possible box of popcorn as you watch this, and make sure you see it while its in cinemas. Pure entertainment. Yep, this was excellent. Boomshakala! Funny, tense surprisingly moving and a brilliant cast. Big fan. Movies like this aren't made any more. Really disappointing to see such a lack of promotion and only a handful of cinemas. There are certain kinds of movies that need to be seen in the cinema, this is one of them. Sucks that everyone is going to see it on their shitty TV's as opposed to how it was meant to be seen. Regardless it's an awesome ride, so check it out. Man seeing James Caan in this is so bittersweet and the fact he plays someone who's dealing with a bit of dementia makes it really sad as you wonder what his last days were actually like. Brosnan was charming as ever. He carries so much weight every time he is in the frame. Didn't see the twist at the end coming (no spoilers) and overall, I didn't expect to learn a whole bunch of new ways to kill a man whilst also feeling so much emotion. Never knew Brosnan was such a talented actor! Completely different from anything I've seen him in! Loved the love story. Big fan of Baccarin after watching her in Gotham. I've read people complaining about Brosnan's accent in this, I think he absolutely nailed it. Those complaining just can't get ‘Bond Brosnan' out of your mind. I'm from where it's set and I can vouch for the accent. Loved this. Had no idea what to expect and got a gangsta film and a beautiful drama all in one! Check it out. Absolutely loved watching this. Despite being a gangster film, it felt different. Action was great and entertaining but so was the drama. Didn't expect that. Highly recommend. ""Fast Charlie"" is a gangster film like no other, breaking the mold with its tenderness and depth. The film's emotional core lies in the unexpected gentleness of its narrative, particularly in the bond between Charlie (Pierce Brosnan) and his boss Stan (James Caan). Their loyalty and affection showcase a softer side of the genre, rarely seen in mob dramas. Similarly, the burgeoning love story, blossoming without even a single kiss, adds a poignant layer to the narrative.

Warwick Thornton's cinematography elevates this sentiment, capturing the essence of the story through beautiful, non-traditional shots that stand apart from typical gangster films. The visual storytelling is both elegant and evocative, bringing a new aesthetic to a familiar genre.

Complementing this is the film's score, which masterfully underscores the narrative's progression. The opening upbeat tracks draw you in, setting the stage for the story, while the emotional beats towards the end mirror the depth and complexity of the characters' journeys. The music enhances the film's tender moments, adding a layer of richness to the storytelling.

""Fast Charlie"" is a refreshing take on the gangster genre, blending action with unexpected warmth and beauty. It's a testament to the versatility of the genre and the power of storytelling that can evoke a wide range of emotions. it was great. I like the plot twist Wow did that suck. Boring and predictable. Terrible fake accents. good film about a man and his choices. his loyalty to his friends and methods never changes and those who he befriends learn that they can rely and trust him. this story has been told billions of times but still holds you till the end. a good moving story, don't be afraid, watch it. Great cast, very entertaining movie. Just barely not a waste of time. Very enjoyable and fun to watch."
